ano;classificacao_do_filme;diretor;duracao;imdb_link;nome;nota;popularidade_score;popularidade_tendencia;poster_link;sinopse
2022;TV-MA;Barbara Bialowas;1h 51m;https://www.imdb.com/title/tt12996154/;365 Days: This Day;2.5;26;popularity-dow;https://www.imdb.com/title/tt12996154/mediaviewer/rm185409025/?ref_=tt_ov_i;Laura and Massimo are back and stronger than ever. But Massimo's family ties and a mysterious man bidding for Laura's heart complicate the lovers' lives.
2021;PG-13;Jon Watts;2h 28m;https://www.imdb.com/title/tt10872600/;Spider-Man: No Way Home;8.3;25;popularity-dow;https://www.imdb.com/title/tt10872600/mediaviewer/rm3936939521/?ref_=tt_ov_i;With Spider-Man's identity now revealed, Peter asks Doctor Strange for help. When a spell goes wrong, dangerous foes from other worlds start to appear, forcing Peter to discover what it truly means to be Spider-Man.
2022;R;Martin Campbell;1h 54m;https://www.imdb.com/title/tt11827628/;Memory;5.6;23;popularity-up;https://www.imdb.com/title/tt11827628/mediaviewer/rm365369601/?ref_=tt_ov_i;An assassin-for-hire finds that he's become a target after he refuses to complete a job for a dangerous criminal organization. A remake of the 2003 Belgian film 'The Memory of a Killer'.
2022;PG;Pierre Perifel;1h 40m;https://www.imdb.com/title/tt8115900/;The Bad Guys;6.9;22;popularity-dow;https://www.imdb.com/title/tt8115900/mediaviewer/rm241363969/?ref_=tt_ov_i;Several reformed yet misunderstood criminal animals attempt to become good, with some disastrous results along the way.
2016;PG-13;Scott Derrickson;1h 55m;https://www.imdb.com/title/tt1211837/;Doctor Strange;7.5;24;popularity-dow;https://www.imdb.com/title/tt1211837/mediaviewer/rm3012758016/?ref_=tt_ov_i;While on a journey of physical and spiritual healing, a brilliant neurosurgeon is drawn into the world of the mystic arts.
2022;PG-13;David Yates;2h 22m;https://www.imdb.com/title/tt4123432/;Fantastic Beasts: The Secrets of Dumbledore;6.4;21;popularity-dow;https://www.imdb.com/title/tt4123432/mediaviewer/rm1659902465/?ref_=tt_ov_i;Albus Dumbledore assigns Newt and his allies with a mission related to the rising power of Grindelwald.
2022;R;George Miller;1h 48m;https://www.imdb.com/title/tt9198364/;Three Thousand Years of Longing;5.7;19;popularity-up;https://www.imdb.com/title/tt9198364/mediaviewer/rm3239056129/?ref_=tt_ov_i;A lonely scholar, on a trip to Istanbul, discovers a Djinn who offers her three wishes in exchange for his freedom.
2022;PG;Simon Curtis;2h 4m;https://www.imdb.com/title/tt11703710/;Downton Abbey: A New Era;7.7;20;popularity-up;https://www.imdb.com/title/tt11703710/mediaviewer/rm3485867009/?ref_=tt_ov_i;Follow-up to the 2019 feature film in which the Crawley family and Downton staff received a royal visit from the King and Queen of Great Britain.
2021;PG-13;M. Night Shyamalan;1h 48m;https://www.imdb.com/title/tt10954652/;Old;5.8;18;popularity-up;https://www.imdb.com/title/tt10954652/mediaviewer/rm2887449857/?ref_=tt_ov_i;A vacationing family discovers that the secluded beach where they're relaxing for a few hours is somehow causing them to age rapidly, reducing their entire lives into a single day.
2022;R;Alex Garland;1h 40m;https://www.imdb.com/title/tt13841850/;Men;6.3;17;popularity-up;https://www.imdb.com/title/tt13841850/mediaviewer/rm2265192449/?ref_=tt_ov_i;A young woman goes on a solo vacation to the English countryside following the death of her ex-husband.
2022;R;Ti West;1h 45m;https://www.imdb.com/title/tt13560574/;X;6.7;16;popularity-neutral;https://www.imdb.com/title/tt13560574/mediaviewer/rm701700609/?ref_=tt_ov_i;In 1979, a group of young filmmakers set out to make an adult film in rural Texas, but when their reclusive, elderly hosts catch them in the act, the cast find themselves fighting for their lives.
2022;PG-13;Ruben Fleischer;1h 56m;https://www.imdb.com/title/tt1464335/;Uncharted;6.4;15;popularity-dow;https://www.imdb.com/title/tt1464335/mediaviewer/rm180740097/?ref_=tt_ov_i;"Street-smart Nathan Drake is recruited by seasoned treasure hunter Victor ""Sully"" Sullivan to recover a fortune amassed by Ferdinand Magellan, and lost 500 years ago by the House of Moncada."
2022;Not rated;James Cameron;;https://www.imdb.com/title/tt1630029/;Avatar: The Way of Water;;13;popularity-dow;https://www.imdb.com/title/tt1630029/mediaviewer/rm1900810753/?ref_=tt_ov_i;Jake Sully lives with his newfound family formed on the planet of Pandora. Once a familiar threat returns to finish what was previously started, Jake must work with Neytiri and the army of the Na'vi race to protect their planet.
2022;PG-13;Matt Reeves;2h 56m;https://www.imdb.com/title/tt1877830/;The Batman;8.0;12;popularity-dow;https://www.imdb.com/title/tt1877830/mediaviewer/rm2474894849/?ref_=tt_ov_i;When a sadistic serial killer begins murdering key political figures in Gotham, Batman is forced to investigate the city's hidden corruption and question his family's involvement.
2022;PG;Akiva Schaffer;1h 37m;https://www.imdb.com/title/tt3513500/;Chip 'n Dale: Rescue Rangers;7.1;11;popularity-up;https://www.imdb.com/title/tt3513500/mediaviewer/rm3687062785/?ref_=tt_ov_i;Thirty years after their popular television show ended, chipmunks Chip and Dale live very different lives. When a cast member from the original series mysteriously disappears, the pair must reunite to save their friend.
2021;PG-13;John Madden;2h 8m;https://www.imdb.com/title/tt1879016/;Operation Mincemeat;6.7;14;popularity-dow;https://www.imdb.com/title/tt1879016/mediaviewer/rm4215283201/?ref_=tt_ov_i;During WWII, two intelligence officers use a corpse and false papers to outwit German troops.
2022;R;Keith Thomas;1h 34m;https://www.imdb.com/title/tt1798632/;Firestarter;4.6;10;popularity-dow;https://www.imdb.com/title/tt1798632/mediaviewer/rm3529172737/?ref_=tt_ov_i;A young girl tries to understand how she mysteriously gained the power to set things on fire with her mind.
1986;PG;Tony Scott;1h 50m;https://www.imdb.com/title/tt0092099/;Top Gun;6.9;9;popularity-up;https://www.imdb.com/title/tt0092099/mediaviewer/rm2145457920/?ref_=tt_ov_i;As students at the United States Navy's elite fighter weapons school compete to be best in the class, one daring young pilot learns a few things from a civilian instructor that are not taught in the classroom.
2022;Not rated;Dan Trachtenberg;;https://www.imdb.com/title/tt11866324/;Prey;;8;popularity-up;https://www.imdb.com/title/tt11866324/mediaviewer/rm2450711553/?ref_=tt_ov_i;The origin story of the Predator in the world of the Comanche Nation 300 years ago. Naru, a skilled female warrior, fights to protect her tribe against one of the first highly-evolved Predators to land on Earth.
2022;R;Dan Kwan;2h 19m;https://www.imdb.com/title/tt6710474/;Everything Everywhere All at Once;8.5;4;popularity-up;https://www.imdb.com/title/tt6710474/mediaviewer/rm316021249/?ref_=tt_ov_i;An aging Chinese immigrant is swept up in an insane adventure, where she alone can save the world by exploring other universes connecting with the lives she could have led.
2022;PG-13;Aaron Nee;1h 52m;https://www.imdb.com/title/tt13320622/;The Lost City;6.2;6;popularity-dow;https://www.imdb.com/title/tt13320622/mediaviewer/rm3056854785/?ref_=tt_ov_i;A reclusive romance novelist on a book tour with her cover model gets swept up in a kidnapping attempt that lands them both in a cutthroat jungle adventure.
2022;PG-13;Daniel Espinosa;1h 44m;https://www.imdb.com/title/tt5108870/;Morbius;5.2;7;popularity-up;https://www.imdb.com/title/tt5108870/mediaviewer/rm2505970177/?ref_=tt_ov_i;Biochemist Michael Morbius tries to cure himself of a rare blood disease, but he inadvertently infects himself with a form of vampirism instead.
2022;R;Robert Eggers;2h 17m;https://www.imdb.com/title/tt11138512/;The Northman;7.4;3;popularity-neutral;https://www.imdb.com/title/tt11138512/mediaviewer/rm2924419329/?ref_=tt_ov_i;From visionary director Robert Eggers comes The Northman, an action-filled epic that follows a young Viking prince on his quest to avenge his father's murder.
2022;R;Alex Hardcastle;1h 51m;https://www.imdb.com/title/tt5315212/;Senior Year;5.5;2;popularity-up;https://www.imdb.com/title/tt5315212/mediaviewer/rm265690881/?ref_=tt_ov_i;A cheerleading stunt gone wrong landed her in a 20-year coma. Now she's 37, newly awake and ready to live out her high school dream: becoming prom queen.
2022;PG-13;Joseph Kosinski;2h 11m;https://www.imdb.com/title/tt1745960/;Top Gun: Maverick;8.7;5;popularity-up;https://www.imdb.com/title/tt1745960/mediaviewer/rm3847166209/?ref_=tt_ov_i;After more than thirty years of service as one of the Navy's top aviators, Pete Mitchell is where he belongs, pushing the envelope as a courageous test pilot and dodging the advancement in rank that would ground him.
