ano;classificacao_do_filme;diretor;duracao;imdb_link;nome;nota;popularidade_score;popularidade_tendencia;poster_link;sinopse
2022;Not rated;James Nunn;1h 27m;https://www.imdb.com/title/tt12550376/;Shark Bait;4.3;61;popularity-up;https://www.imdb.com/title/tt12550376/mediaviewer/rm3472167425/?ref_=tt_ov_i;A group of friends enjoying a weekend steal a couple of jetskis racing them out to sea, ending up in a horrific head-on collision. They struggle to find a way home with a badly injured friend while from the waters below predators lurk.
2022;PG-13;Sam Raimi;2h 6m;https://www.imdb.com/title/tt9419884/;Doctor Strange in the Multiverse of Madness;7.3;1;popularity-neutral;https://www.imdb.com/title/tt9419884/mediaviewer/rm339811841/?ref_=tt_ov_i;Doctor Strange teams up with a mysterious teenage girl from his dreams who can travel across multiverses, to battle multiple threats, including other-universe versions of himself, which threaten to wipe out millions across the multiverse. They seek help from Wanda the Scarlet Witch, Wong and others.
2022;Not rated;Hanna Bergholm;1h 26m;https://www.imdb.com/title/tt12519030/;Hatching;6.4;56;popularity-up;https://www.imdb.com/title/tt12519030/mediaviewer/rm844634113/?ref_=tt_ov_i;A young gymnast who tries desperately to please her demanding mother, discovers a strange egg. She hides it and keeps it warm, but when it hatches, what emerges shocks them all.
2022;Not Rated;Prashanth Neel;2h 48m;https://www.imdb.com/title/tt10698680/;K.G.F: Chapter 2;8.7;55;popularity-dow;https://www.imdb.com/title/tt10698680/mediaviewer/rm1822812417/?ref_=tt_ov_i;In the blood-soaked Kolar Gold Fields, Rocky's name strikes fear into his foes. While his allies look up to him, the government sees him as a threat to law and order. Rocky must battle threats from all sides for unchallenged supremacy.
2019;PG;Michael Engler;2h 2m;https://www.imdb.com/title/tt6398184/;Downton Abbey;7.4;58;popularity-up;https://www.imdb.com/title/tt6398184/mediaviewer/rm2990120193/?ref_=tt_ov_i;The continuing story of the Crawley family, wealthy owners of a large estate in the English countryside in the early twentieth century.
2021;PG-13;Chloé Zhao;2h 36m;https://www.imdb.com/title/tt9032400/;Eternals;6.3;60;popularity-dow;https://www.imdb.com/title/tt9032400/mediaviewer/rm1516895489/?ref_=tt_ov_i;The saga of the Eternals, a race of immortal beings who lived on Earth and shaped its history and civilizations.
2019;R;Guy Ritchie;1h 53m;https://www.imdb.com/title/tt8367814/;The Gentlemen;7.8;59;popularity-dow;https://www.imdb.com/title/tt8367814/mediaviewer/rm1937148929/?ref_=tt_ov_i;An American expat tries to sell off his highly profitable marijuana empire in London, triggering plots, schemes, bribery and blackmail in an attempt to steal his domain out from under him.
2022;PG-13;Roland Emmerich;2h 10m;https://www.imdb.com/title/tt5834426/;Moonfall;5.2;57;popularity-dow;https://www.imdb.com/title/tt5834426/mediaviewer/rm3879723521/?ref_=tt_ov_i;A mysterious force knocks the moon from its orbit around Earth and sends it hurtling on a collision course with life as we know it.
2022;R;Joseph Kosinski;1h 46m;https://www.imdb.com/title/tt9783600/;Spiderhead;;50;popularity-up;https://www.imdb.com/title/tt9783600/mediaviewer/rm4200076033/?ref_=tt_ov_i;In the near future, convicts are offered the chance to volunteer as medical subjects to shorten their sentence. One such subject for a new drug capable of generating feelings of love begins questioning the reality of his emotions.
1998;R;Terry Gilliam;1h 58m;https://www.imdb.com/title/tt0120669/;Fear and Loathing in Las Vegas;7.5;52;popularity-up;https://www.imdb.com/title/tt0120669/mediaviewer/rm2647909376/?ref_=tt_ov_i;An oddball journalist and his psychopathic lawyer travel to Las Vegas for a series of psychedelic escapades.
2003;PG-13;Gore Verbinski;2h 23m;https://www.imdb.com/title/tt0325980/;Pirates of the Caribbean: The Curse of the Black Pearl;8.0;49;popularity-dow;https://www.imdb.com/title/tt0325980/mediaviewer/rm2487103488/?ref_=tt_ov_i;"Blacksmith Will Turner teams up with eccentric pirate ""Captain"" Jack Sparrow to save his love, the governor's daughter, from Jack's former pirate allies, who are now undead."
2022;PG;Jim Archer;1h 30m;https://www.imdb.com/title/tt13270424/;Brian and Charles;8.3;54;popularity-up;https://www.imdb.com/title/tt13270424/mediaviewer/rm2522747649/?ref_=tt_ov_i;After a particularly harsh winter Brian goes into a deep depression
2022;R;Jeremiah Zagar;1h 57m;https://www.imdb.com/title/tt8009428/;Hustle;;53;popularity-dow;https://www.imdb.com/title/tt8009428/mediaviewer/rm1273697025/?ref_=tt_ov_i;A washed-up basketball scout discovers a phenomenal street ball player while in Spain and sees the prospect as his opportunity to get back into the NBA.
2021;R;Lana Wachowski;2h 28m;https://www.imdb.com/title/tt10838180/;The Matrix Resurrections;5.7;47;popularity-up;https://www.imdb.com/title/tt10838180/mediaviewer/rm3704744193/?ref_=tt_ov_i;Return to a world of two realities: one, everyday life
1984;R;Mark L. Lester;1h 54m;https://www.imdb.com/title/tt0087262/;Firestarter;6.0;51;popularity-up;https://www.imdb.com/title/tt0087262/mediaviewer/rm256704512/?ref_=tt_ov_i;A couple who participated in a potent medical experiment gain telepathic ability and then have a child who is pyrokinetic.
2021;PG-13;Shawn Levy;1h 55m;https://www.imdb.com/title/tt6264654/;Free Guy;7.1;100;popularity-dow;https://www.imdb.com/title/tt6264654/mediaviewer/rm2006762753/?ref_=tt_ov_i;A bank teller discovers that he's actually an NPC inside a brutal, open world video game.
2022;Not Rated;S.S. Rajamouli;3h 7m;https://www.imdb.com/title/tt8178634/;RRR;8.2;48;popularity-up;https://www.imdb.com/title/tt8178634/mediaviewer/rm1757810689/?ref_=tt_ov_i;A fictitious story about two legendary revolutionaries and their journey away from home before they started fighting for their country in 1920's.
2000;R;Mary Harron;1h 42m;https://www.imdb.com/title/tt0144084/;American Psycho;7.6;97;popularity-dow;https://www.imdb.com/title/tt0144084/mediaviewer/rm3296681472/?ref_=tt_ov_i;A wealthy New York City investment banking executive, Patrick Bateman, hides his alternate psychopathic ego from his co-workers and friends as he delves deeper into his violent, hedonistic fantasies.
2021;R;James Gunn;2h 12m;https://www.imdb.com/title/tt6334354/;The Suicide Squad;7.2;96;popularity-dow;https://www.imdb.com/title/tt6334354/mediaviewer/rm662696705/?ref_=tt_ov_i;Supervillains Harley Quinn, Bloodsport, Peacemaker, and a collection of nutty cons at Belle Reve prison join the super-secret, super-shady Task Force X as they are dropped off at the remote, enemy-infused island of Corto Maltese.
2020;R;Craig Zobel;1h 30m;https://www.imdb.com/title/tt8244784/;The Hunt;6.5;99;popularity-up;https://www.imdb.com/title/tt8244784/mediaviewer/rm4188322305/?ref_=tt_ov_i;Twelve strangers wake up in a clearing. They don't know where they are, or how they got there. They don't know they've been chosen - for a very specific purpose - The Hunt.
2021;R;Joachim Trier;2h 8m;https://www.imdb.com/title/tt10370710/;The Worst Person in the World;7.9;98;popularity-up;https://www.imdb.com/title/tt10370710/mediaviewer/rm2792219649/?ref_=tt_ov_i;The chronicles of four years in the life of Julie, a young woman who navigates the troubled waters of her love life and struggles to find her career path, leading her to take a realistic look at who she really is.
2021;R;Guillermo del Toro;2h 30m;https://www.imdb.com/title/tt7740496/;Nightmare Alley;7.1;95;popularity-dow;https://www.imdb.com/title/tt7740496/mediaviewer/rm749334273/?ref_=tt_ov_i;A grifter working his way up from low-ranking carnival worker to lauded psychic medium matches wits with a psychiatrist bent on exposing him.
2022;TV-14;Sofia Alvarez;1h 46m;https://www.imdb.com/title/tt14506528/;Along for the Ride;6.0;94;popularity-dow;https://www.imdb.com/title/tt14506528/mediaviewer/rm644880641/?ref_=tt_ov_i;The summer before college Auden meets the mysterious Eli, a fellow insomniac. While the seaside town of Colby sleeps, the two embark on a nightly quest to help Auden experience the fun, carefree teen life she never knew she wanted.
2022;R;Jared Cohn;1h 36m;https://www.imdb.com/title/tt14849038/;Vendetta;3.8;92;popularity-up;https://www.imdb.com/title/tt14849038/mediaviewer/rm2997948929/?ref_=tt_ov_i;When his daughter is brutally murdered and legal justice looks unlikely, William Duncan takes the law into his own hands, setting out on a quest for retribution. After killing the street thug who was directly responsible for her death, he finds himself in the middle of a war with the thug's brother, Rory Fetter, and his gang, who are equally hell-bent on getting even ...
2022;Not rated;Anees Bazmee;2h 23m;https://www.imdb.com/title/tt6455162/;Bhool Bhulaiyaa 2;7.2;93;popularity-up;https://www.imdb.com/title/tt6455162/mediaviewer/rm1479613441/?ref_=tt_ov_i;A casual encounter between two strangers, Ruhaan and Reet, sends them to visit Reet's hometown in Rajasthan, where they uncover an old secret that results in panic.
2008;PG-13;Christopher Nolan;2h 32m;https://www.imdb.com/title/tt0468569/;The Dark Knight;9.0;91;popularity-dow;https://www.imdb.com/title/tt0468569/mediaviewer/rm4023877632/?ref_=tt_ov_i;When the menace known as the Joker wreaks havoc and chaos on the people of Gotham, Batman must accept one of the greatest psychological and physical tests of his ability to fight injustice.
2015;R;Robert Eggers;1h 32m;https://www.imdb.com/title/tt4263482/;The Witch;6.9;90;popularity-neutral;https://www.imdb.com/title/tt4263482/mediaviewer/rm2328686080/?ref_=tt_ov_i;A family in 1630s New England is torn apart by the forces of witchcraft, black magic, and possession.
2021;PG-13;Sian Heder;1h 51m;https://www.imdb.com/title/tt10366460/;CODA;8.0;89;popularity-dow;https://www.imdb.com/title/tt10366460/mediaviewer/rm759954177/?ref_=tt_ov_i;As a CODA (Child of Deaf Adults) Ruby is the only hearing person in her deaf family. When the family's fishing business is threatened, Ruby finds herself torn between pursuing her passion at Berklee College of Music and her fear of abandoning her parents.
2019;R;Ari Aster;2h 28m;https://www.imdb.com/title/tt8772262/;Midsommar;7.1;88;popularity-up;https://www.imdb.com/title/tt8772262/mediaviewer/rm3772802304/?ref_=tt_ov_i;A couple travels to Northern Europe to visit a rural hometown's fabled Swedish mid-summer festival. What begins as an idyllic retreat quickly devolves into an increasingly violent and bizarre competition at the hands of a pagan cult.
2022;TV-G;Elizabeth Allen Rosenbaum;1h 52m;https://www.imdb.com/title/tt10160886/;Sneakerella;4.4;87;popularity-up;https://www.imdb.com/title/tt10160886/mediaviewer/rm1292312065/?ref_=tt_ov_i;A modern twist on Cinderella set in New York City's Sneaker culture.
2022;R;Matt Bettinelli-Olpin;1h 54m;https://www.imdb.com/title/tt11245972/;Scream;6.4;85;popularity-dow;https://www.imdb.com/title/tt11245972/mediaviewer/rm1059724033/?ref_=tt_ov_i;25 years after a streak of brutal murders shocked the quiet town of Woodsboro, Calif., a new killer dons the Ghostface mask and begins targeting a group of teenagers to resurrect secrets from the town's deadly past.
2023;Not rated;Greta Gerwig;;https://www.imdb.com/title/tt1517268/;Barbie;;83;popularity-up;https://www.imdb.com/title/tt1517268/mediaviewer/rm1288969473/?ref_=tt_ov_i;
2017;PG-13;Joachim Rønning;2h 9m;https://www.imdb.com/title/tt1790809/;Pirates of the Caribbean: Dead Men Tell No Tales;6.5;84;popularity-dow;https://www.imdb.com/title/tt1790809/mediaviewer/rm337719808/?ref_=tt_ov_i;Captain Jack Sparrow is pursued by old rival Captain Salazar and a crew of deadly ghosts who have escaped from the Devil's Triangle. They're determined to kill every pirate at sea...notably Jack.
2023;Not rated;James Wan;;https://www.imdb.com/title/tt9663764/;Aquaman and the Lost Kingdom;;86;popularity-up;https://www.imdb.com/title/tt9663764/mediaviewer/rm3564946689/?ref_=tt_ov_i;Plot unknown. Sequel to the 2018 film 'Aquaman.'
2021;PG;Jared Bush;1h 42m;https://www.imdb.com/title/tt2953050/;Encanto;7.2;80;popularity-dow;https://www.imdb.com/title/tt2953050/mediaviewer/rm2541025281/?ref_=tt_ov_i;A Colombian teenage girl has to face the frustration of being the only member of her family without magical powers.
2021;R;Matthew Vaughn;2h 11m;https://www.imdb.com/title/tt6856242/;The King's Man;6.3;81;popularity-dow;https://www.imdb.com/title/tt6856242/mediaviewer/rm1942154753/?ref_=tt_ov_i;In the early years of the 20th century, the Kingsman agency is formed to stand against a cabal plotting a war to wipe out millions.
2022;PG-13;Reid Carolin;1h 41m;https://www.imdb.com/title/tt11252248/;Dog;6.5;79;popularity-up;https://www.imdb.com/title/tt11252248/mediaviewer/rm769452289/?ref_=tt_ov_i;Two former Army Rangers are paired against their will on the road trip of a lifetime. Briggs (Channing Tatum) and Lulu (a Belgian Malinois) race down the Pacific Coast to get to a fellow soldier's funeral on time.
2022;PG;Domee Shi;1h 40m;https://www.imdb.com/title/tt8097030/;Turning Red;7.0;82;popularity-dow;https://www.imdb.com/title/tt8097030/mediaviewer/rm1685446657/?ref_=tt_ov_i;A 13-year-old girl named Meilin turns into a giant red panda whenever she gets too excited.
2022;R;Nicholas Stoller;;https://www.imdb.com/title/tt9731598/;Bros;;77;popularity-up;https://www.imdb.com/title/tt9731598/mediaviewer/rm1346048769/?ref_=tt_ov_i;Two men with commitment problems attempt a relationship.
2022;TV-MA;Mehdi Avaz;1h 30m;https://www.imdb.com/title/tt13276352/;Toscana;5.8;78;popularity-up;https://www.imdb.com/title/tt13276352/mediaviewer/rm95624449/?ref_=tt_ov_i;When a Danish chef travels to Tuscany to sell his father's business, he meets a local woman who inspires him to rethink his approach to life and love.
2022;PG-13;Shawn Levy;1h 46m;https://www.imdb.com/title/tt2463208/;The Adam Project;6.7;75;popularity-dow;https://www.imdb.com/title/tt2463208/mediaviewer/rm2312247809/?ref_=tt_ov_i;After accidentally crash-landing in 2022, time-traveling fighter pilot Adam Reed teams up with his 12-year-old self for a mission to save the future.
2022;PG-13;Chris Sivertson;1h 29m;https://www.imdb.com/title/tt4624366/;Monstrous;4.6;76;popularity-up;https://www.imdb.com/title/tt4624366/mediaviewer/rm620698625/?ref_=tt_ov_i;Story centers on a traumatized woman fleeing from her abusive ex-husband with her 7-year-old son. In their new, remote sanctuary they find they have a bigger, more terrifying monster to deal with.
2021;Not rated;Rob Jabbaz;1h 39m;https://www.imdb.com/title/tt13872248/;The Sadness;6.5;71;popularity-up;https://www.imdb.com/title/tt13872248/mediaviewer/rm76215809/?ref_=tt_ov_i;A young couple trying to reunite amid a city ravaged by a plague that turns its victims into deranged, bloodthirsty sadists.
2022;Not rated;Debbie D'Souza;1h 29m;https://www.imdb.com/title/tt18924506/;2000 Mules;6.8;73;popularity-dow;https://www.imdb.com/title/tt18924506/mediaviewer/rm2931102209/?ref_=tt_ov_i;"""2000 Mules,"" a documentary film created by Dinesh D'Souza, exposes widespread, coordinated voter fraud in the 2020 election, sufficient to change the overall outcome."
1994;R;Frank Darabont;2h 22m;https://www.imdb.com/title/tt0111161/;The Shawshank Redemption;9.3;74;popularity-dow;https://www.imdb.com/title/tt0111161/mediaviewer/rm10105600/?ref_=tt_ov_i;Two imprisoned men bond over a number of years, finding solace and eventual redemption through acts of common decency.
2021;PG;Garth Jennings;1h 50m;https://www.imdb.com/title/tt6467266/;Sing 2;7.4;72;popularity-dow;https://www.imdb.com/title/tt6467266/mediaviewer/rm3770805761/?ref_=tt_ov_i;Buster Moon and his friends must persuade reclusive rock star Clay Calloway to join them for the opening of a new show.
2022;R;Machine Gun Kelly;1h 33m;https://www.imdb.com/title/tt15331186/;Good Mourning;3.7;70;popularity-up;https://www.imdb.com/title/tt15331186/mediaviewer/rm3880656641/?ref_=tt_ov_i;Follows London Clash, a movie star whose world is turned upside down when he must choose between pursuing his one true love and landing a life-changing, starring role in a major motion picture.
2015;TV-MA;Gaspar Noé;2h 15m;https://www.imdb.com/title/tt3774694/;Love;6.0;68;popularity-up;https://www.imdb.com/title/tt3774694/mediaviewer/rm626325248/?ref_=tt_ov_i;Murphy is an American living in Paris who enters a highly sexually and emotionally charged relationship with Electra. Unaware of the effect it will have on their relationship, they invite their pretty neighbor into their bed.
2019;PG-13;Anthony Russo;3h 1m;https://www.imdb.com/title/tt4154796/;Avengers: Endgame;8.4;67;popularity-dow;https://www.imdb.com/title/tt4154796/mediaviewer/rm2775147008/?ref_=tt_ov_i;After the devastating events of Avengers: Infinity War (2018), the universe is in ruins. With the help of remaining allies, the Avengers assemble once more in order to reverse Thanos' actions and restore balance to the universe.
2021;R;Paul Thomas Anderson;2h 13m;https://www.imdb.com/title/tt11271038/;Licorice Pizza;7.3;69;popularity-up;https://www.imdb.com/title/tt11271038/mediaviewer/rm3994608129/?ref_=tt_ov_i;The story of Alana Kane and Gary Valentine growing up, running around and going through the treacherous navigation of first love in the San Fernando Valley, 1973.
2022;R;Jesse Harris;1h 42m;https://www.imdb.com/title/tt12676006/;Borrego;5.4;66;popularity-up;https://www.imdb.com/title/tt12676006/mediaviewer/rm371843329/?ref_=tt_ov_i;Borrego follows a young botanist who relocates to a small desert town to study an invasive plant species. She must fight for her survival when she's kidnapped by an inexperienced drug mule after his ultralight plane crashes in the desert.
2022;R;Graham Moore;1h 45m;https://www.imdb.com/title/tt14114802/;The Outfit;7.1;65;popularity-dow;https://www.imdb.com/title/tt14114802/mediaviewer/rm655091457/?ref_=tt_ov_i;An expert cutter must outwit a dangerous group of mobsters in order to survive a fateful night.
2021;PG-13;Cary Joji Fukunaga;2h 43m;https://www.imdb.com/title/tt2382320/;No Time to Die;7.3;64;popularity-dow;https://www.imdb.com/title/tt2382320/mediaviewer/rm1714747649/?ref_=tt_ov_i;James Bond has left active service. His peace is short-lived when Felix Leiter, an old friend from the CIA, turns up asking for help, leading Bond onto the trail of a mysterious villain armed with dangerous new technology.
2022;Not rated;Divyang Thakkar;2h 1m;https://www.imdb.com/title/tt10393870/;Jayeshbhai Jordaar;7.6;63;popularity-up;https://www.imdb.com/title/tt10393870/mediaviewer/rm2546605313/?ref_=tt_ov_i;A timid Jayesh must defy his patriarchal family as he flees with his wife to save their unborn daughter from foeticide.
2022;Not rated;Olivia Newman;;https://www.imdb.com/title/tt9411972/;Where the Crawdads Sing;;46;popularity-up;https://www.imdb.com/title/tt9411972/mediaviewer/rm2552633345/?ref_=tt_ov_i;A woman who raised herself in the marshes of the deep South becomes a suspect in the murder of a man she was once involved with.
2022;R;Sophie Hyde;1h 37m;https://www.imdb.com/title/tt13352968/;Good Luck to You, Leo Grande;7.1;62;popularity-up;https://www.imdb.com/title/tt13352968/mediaviewer/rm3647935233/?ref_=tt_ov_i;Follows Nancy Stokes, a 55 year-old widow who is yearning for some adventure, human connection and some sex, good sex.
2022;PG-13;Richard Wong;2h 4m;https://www.imdb.com/title/tt4081630/;The Valet;6.7;44;popularity-up;https://www.imdb.com/title/tt4081630/mediaviewer/rm522263809/?ref_=tt_ov_i;A movie star enlists a parking valet at a Beverly Hills restaurant to pose as her lover to cover for her relationship with a married man.
2022;R;Michael Bay;2h 16m;https://www.imdb.com/title/tt4998632/;Ambulance;6.1;45;popularity-dow;https://www.imdb.com/title/tt4998632/mediaviewer/rm2710955009/?ref_=tt_ov_i;Two robbers steal an ambulance after their heist goes awry.
2021;PG-13;Denis Villeneuve;2h 35m;https://www.imdb.com/title/tt1160419/;Dune;8.1;42;popularity-dow;https://www.imdb.com/title/tt1160419/mediaviewer/rm2910452737/?ref_=tt_ov_i;A noble family becomes embroiled in a war for control over the galaxy's most valuable asset while its heir becomes troubled by visions of a dark future.
2021;Unrated;Ninja Thyberg;1h 49m;https://www.imdb.com/title/tt8550054/;Pleasure;6.3;43;popularity-up;https://www.imdb.com/title/tt8550054/mediaviewer/rm1708530433/?ref_=tt_ov_i;Bella Cherry arrives in Los Angeles with dreams of becoming an adult film star, but she soon learns that fame won't come easy as she harnesses her ambition and cunning to rise to the top of this mesmerizing and singular world.
2022;PG-13;Baz Luhrmann;2h 39m;https://www.imdb.com/title/tt3704428/;Elvis;;41;popularity-up;https://www.imdb.com/title/tt3704428/mediaviewer/rm4213302273/?ref_=tt_ov_i;A look at the life of the legendary rock and roll star, Elvis Presley.
2009;PG-13;James Cameron;2h 42m;https://www.imdb.com/title/tt0499549/;Avatar;7.8;40;popularity-dow;https://www.imdb.com/title/tt0499549/mediaviewer/rm2864126209/?ref_=tt_ov_i;A paraplegic Marine dispatched to the moon Pandora on a unique mission becomes torn between following his orders and protecting the world he feels is his home.
2011;R;Bruce Robinson;1h 59m;https://www.imdb.com/title/tt0376136/;The Rum Diary;6.1;39;popularity-dow;https://www.imdb.com/title/tt0376136/mediaviewer/rm3607015936/?ref_=tt_ov_i;American journalist Paul Kemp takes on a freelance job in Puerto Rico for a local newspaper during the 1960s and struggles to find a balance between island culture and the expatriates who live there.
2022;TV-MA;Lucie Jourdan;1h 37m;https://www.imdb.com/title/tt19704638/;Our Father;6.6;38;popularity-up;https://www.imdb.com/title/tt19704638/mediaviewer/rm1094262529/?ref_=tt_ov_i;After a woman's at-home DNA test reveals multiple half-siblings, she discovers a shocking scheme involving donor sperm and a popular fertility doctor.
2022;R;Tom Gormican;1h 47m;https://www.imdb.com/title/tt11291274/;The Unbearable Weight of Massive Talent;7.4;37;popularity-dow;https://www.imdb.com/title/tt11291274/mediaviewer/rm289347585/?ref_=tt_ov_i;In this action-packed comedy, Nicolas Cage plays Nick Cage, channeling his iconic characters as he's caught between a superfan (Pedro Pascal) and a CIA agent (Tiffany Haddish).
1972;R;Francis Ford Coppola;2h 55m;https://www.imdb.com/title/tt0068646/;The Godfather;9.2;33;popularity-dow;https://www.imdb.com/title/tt0068646/mediaviewer/rm746868224/?ref_=tt_ov_i;The aging patriarch of an organized crime dynasty in postwar New York City transfers control of his clandestine empire to his reluctant youngest son.
2022;TV-14;Stuart McDonald;1h 41m;https://www.imdb.com/title/tt15215512/;A Perfect Pairing;6.1;35;popularity-up;https://www.imdb.com/title/tt15215512/mediaviewer/rm2253069569/?ref_=tt_ov_i;It follows a hard-driving LA wine-company executive who travels to an Australian sheep station to land a major client and there she ends up working as a ranch hand and sparking with a rugged local.
2022;PG-13;Colin Trevorrow;2h 26m;https://www.imdb.com/title/tt8041270/;Jurassic World Dominion;;36;popularity-dow;https://www.imdb.com/title/tt8041270/mediaviewer/rm2502434561/?ref_=tt_ov_i;Four years after the destruction of Isla Nublar, dinosaurs now live--and hunt--alongside humans all over the world. This fragile balance will reshape the future and determine, once and for all, whether human beings are to remain the apex predators on a planet they now share with history's most fearsome creatures in a new Era.
2022;PG;Jeff Fowler;2h 2m;https://www.imdb.com/title/tt12412888/;Sonic the Hedgehog 2;6.6;32;popularity-dow;https://www.imdb.com/title/tt12412888/mediaviewer/rm3541045761/?ref_=tt_ov_i;When the manic Dr Robotnik returns to Earth with a new ally, Knuckles the Echidna, Sonic and his new friend Tails is all that stands in their way.
2011;R;Brad Furman;1h 58m;https://www.imdb.com/title/tt1189340/;The Lincoln Lawyer;7.3;34;popularity-up;https://www.imdb.com/title/tt1189340/mediaviewer/rm2623570944/?ref_=tt_ov_i;A lawyer defending a wealthy man begins to believe his client is guilty of more than just one crime.
2020;TV-MA;Barbara Bialowas;1h 54m;https://www.imdb.com/title/tt10886166/;365 Days;3.3;31;popularity-dow;https://www.imdb.com/title/tt10886166/mediaviewer/rm3937276417/?ref_=tt_ov_i;Massimo is a member of the Sicilian Mafia family and Laura is a sales director. She does not expect that on a trip to Sicily trying to save her relationship, Massimo will kidnap her and give her 365 days to fall in love with him.
2018;PG-13;James Wan;2h 23m;https://www.imdb.com/title/tt1477834/;Aquaman;6.8;30;popularity-up;https://www.imdb.com/title/tt1477834/mediaviewer/rm1695707136/?ref_=tt_ov_i;Arthur Curry, the human-born heir to the underwater kingdom of Atlantis, goes on a quest to prevent a war between the worlds of ocean and land.
2022;PG-13;Kenneth Branagh;2h 7m;https://www.imdb.com/title/tt7657566/;Death on the Nile;6.3;28;popularity-dow;https://www.imdb.com/title/tt7657566/mediaviewer/rm1287056641/?ref_=tt_ov_i;While on vacation on the Nile, Hercule Poirot must investigate the murder of a young heiress.
2022;Not rated;Taika Waititi;;https://www.imdb.com/title/tt10648342/;Thor: Love and Thunder;;29;popularity-dow;https://www.imdb.com/title/tt10648342/mediaviewer/rm3968995329/?ref_=tt_ov_i;Thor enlists the help of Valkyrie, Korg and ex-girlfriend Jane Foster to fight Gorr the God Butcher, who intends to make the gods extinct.
2021;PG-13;Jason Reitman;2h 4m;https://www.imdb.com/title/tt4513678/;Ghostbusters: Afterlife;7.1;27;popularity-up;https://www.imdb.com/title/tt4513678/mediaviewer/rm2083320065/?ref_=tt_ov_i;When a single mom and her two kids arrive in a small town, they begin to discover their connection to the original Ghostbusters and the secret legacy their grandfather left behind.
